{
  "schema_version": 1,
  "sources": [
    {
      "document_id": "nmct-contact-web-20261007",
      "version": 1,
      "title": "Холбоо барих",
      "source_url_or_filename": "https://nmct.edu.mn/contact",
      "retrieved_at": "2026-10-09",
      "source_updated_at": null,
      "scope": "q01;q04;q06;q13;q16;q18",
      "content_capture": "selected_fact_extract",
      "notes": "Хаяг, ерөнхий утас, имэйл, ажлын цаг байна. Сургалтын албаны тусгай цаг/утас гэж заагаагүй. Хуудасны шинэчилсэн огноо; албаны тусгай холбоо; хүчинтэй хугацаа; батлагч Web tool crawl can predate the check; full HTML is not captured.",
      "approval_status": "draft",
      "approved_by": null,
      "approved_at": null,
      "valid_from": null,
      "valid_until": null
    },
    {
      "document_id": "nmct-admissions-web-20261007",
      "version": 1,
      "title": "Элсэлт 2026",
      "source_url_or_filename": "https://nmct.edu.mn/elselt",
      "retrieved_at": "2026-10-09",
      "source_updated_at": null,
      "scope": "q03;q05;q11;q12;q14;q15;q18",
      "content_capture": "audit_metadata_only",
      "notes": "2026 оны мэдээлэл байна. Дээд мэдэгдэл эхэлсэн, үндсэн хэсэг хаагдсан гэж зөрнө. Хаагдах 8/13 гэж харагдана; 10/15-ныг дэмжихгүй. Идэвхтэй эсэх; шинэчилсэн огноо; 2027 оны төлбөр; 2025 оны хувилбар; батлагч Web tool crawl can predate the check; full HTML is not captured.",
      "approval_status": "draft",
      "approved_by": null,
      "approved_at": null,
      "valid_from": null,
      "valid_until": null
    },
    {
      "document_id": "nmct-departments-web-20261007",
      "version": 1,
      "title": "Тэнхимүүд",
      "source_url_or_filename": "https://nmct.edu.mn/departments",
      "retrieved_at": "2026-10-07",
      "source_updated_at": null,
      "scope": "q02;q05;q07;q08;q09;q17",
      "content_capture": "audit_metadata_only",
      "notes": "Тэнхимийн жагсаалт ба хамтын ажиллагааны мэдээлэл байна. КУ-ны дэлгэрэнгүйтэй давхцах тул бие даасан давхар баталгаа гэж тооцохгүй. Шинэчилсэн огноо; хүчинтэй хугацаа; батлагч Web tool crawl can predate the check; full HTML is not captured.",
      "approval_status": "draft",
      "approved_by": null,
      "approved_at": null,
      "valid_from": null,
      "valid_until": null
    },
    {
      "document_id": "nmct-cs-web-20261007",
      "version": 1,
      "title": "Компьютерын ухааны тэнхим",
      "source_url_or_filename": "https://nmct.edu.mn/departments/computer-science",
      "retrieved_at": "2026-10-09",
      "source_updated_at": null,
      "scope": "q02;q07;q08;q09;q17",
      "content_capture": "selected_fact_extract",
      "notes": "КУ-ны сургалт ба Sakura/ARC хамтын ажиллагааны дэлгэрэнгүй байна; өмнөх draft эхтэй гол агуулга таарч байна. Шинэчилсэн огноо; хүчинтэй хугацаа; батлагч Web tool crawl can predate the check; full HTML is not captured.",
      "approval_status": "draft",
      "approved_by": null,
      "approved_at": null,
      "valid_from": null,
      "valid_until": null
    },
    {
      "document_id": "nmct-about-web-20261007",
      "version": 1,
      "title": "Бидний тухай",
      "source_url_or_filename": "https://nmct.edu.mn/about",
      "retrieved_at": "2026-10-07",
      "source_updated_at": null,
      "scope": "Сургуулийн ерөнхий танилцуулга",
      "content_capture": "audit_metadata_only",
      "notes": "Эрхэм зорилго, бүтэц, ерөнхий танилцуулга байна. Хувь хүний нэр/албан тушаал шинэчлэгдэж болох мэдээлэл. Шинэчилсэн огноо; хүчинтэй хугацаа; батлагч Web tool crawl can predate the check; full HTML is not captured.",
      "approval_status": "draft",
      "approved_by": null,
      "approved_at": null,
      "valid_from": null,
      "valid_until": null
    },
    {
      "document_id": "nmct-cs-program-web-20261009",
      "version": 1,
      "title": "Компьютерын ухааны хөтөлбөр",
      "source_url_or_filename": "https://nmct.edu.mn/programs/computer-science-program",
      "retrieved_at": "2026-10-09",
      "source_updated_at": null,
      "scope": "Хөтөлбөрийн ерөнхий чиглэл ба практик сургалтын хэлбэр; улирал тус бүрийн бүтэн төлөвлөгөө биш.",
      "content_capture": "selected_fact_extract",
      "notes": "Official department page links here. Checked web text; crawler dated last month. No full HTML snapshot, source update date or human approval.",
      "approval_status": "draft",
      "approved_by": null,
      "approved_at": null,
      "valid_from": null,
      "valid_until": null
    }
  ],
  "facts": [
    {
      "fact_id": "school.general_phone",
      "entity_id": "nmct",
      "key": "general_phone",
      "value": "+976 75777799",
      "source_refs": [
        {
          "document_id": "nmct-contact-web-20261007",
          "version": 1,
          "locator": "Хаяг мэдээлэл / Утас"
        }
      ],
      "scope": "Сургуулийн ерөнхий холбоо; сургалтын албаны тусгай дугаар гэж нэрлэхгүй.",
      "notes": "",
      "approval_status": "draft",
      "approved_by": null,
      "approved_at": null,
      "valid_from": null,
      "valid_until": null
    },
    {
      "fact_id": "school.general_email",
      "entity_id": "nmct",
      "key": "general_email",
      "value": "info@nmct.edu.mn",
      "source_refs": [
        {
          "document_id": "nmct-contact-web-20261007",
          "version": 1,
          "locator": "Хаяг мэдээлэл / Имэйл"
        }
      ],
      "scope": "Сургуулийн ерөнхий холбоо.",
      "notes": "",
      "approval_status": "draft",
      "approved_by": null,
      "approved_at": null,
      "valid_from": null,
      "valid_until": null
    },
    {
      "fact_id": "school.location",
      "entity_id": "nmct",
      "key": "location",
      "value": "Улаанбаатар хот, Баянзүрх дүүрэг, 25-р хороо, шинэ монгол",
      "source_refs": [
        {
          "document_id": "nmct-contact-web-20261007",
          "version": 1,
          "locator": "Хаяг мэдээлэл / Хаяг"
        }
      ],
      "scope": "Сайтад байгаа хаяг; байрны нарийвчилсан дугаар болон газрын зураг батлагдаагүй.",
      "notes": "",
      "approval_status": "draft",
      "approved_by": null,
      "approved_at": null,
      "valid_from": null,
      "valid_until": null
    },
    {
      "fact_id": "cs.sakura.start_month",
      "entity_id": "nmct.computer_science",
      "key": "sakura_start_month",
      "value": "2024-03",
      "source_refs": [
        {
          "document_id": "nmct-cs-web-20261007",
          "version": 1,
          "locator": "Хамтын ажиллагаа / Sakura Internet"
        }
      ],
      "scope": "Хамтын ажиллагааны эхэлсэн сар; яг өдрийг таамаглахгүй.",
      "notes": "",
      "approval_status": "draft",
      "approved_by": null,
      "approved_at": null,
      "valid_from": null,
      "valid_until": null
    },
    {
      "fact_id": "cs.arc.start_month",
      "entity_id": "nmct.computer_science",
      "key": "arc_start_month",
      "value": "2025-02",
      "source_refs": [
        {
          "document_id": "nmct-cs-web-20261007",
          "version": 1,
          "locator": "Хамтын ажиллагаа / ARC"
        }
      ],
      "scope": "Хамтын ажиллагааны эхэлсэн сар; яг өдрийг таамаглахгүй.",
      "notes": "",
      "approval_status": "draft",
      "approved_by": null,
      "approved_at": null,
      "valid_from": null,
      "valid_until": null
    },
    {
      "fact_id": "cs.arc.courses",
      "entity_id": "nmct.computer_science",
      "key": "arc_courses",
      "value": [
        "Интернэт технологи",
        "Үйлдлийн систем",
        "Мэдээллийн нууцлал, хамгаалал"
      ],
      "source_refs": [
        {
          "document_id": "nmct-cs-web-20261007",
          "version": 1,
          "locator": "Хамтын ажиллагаа / ARC"
        }
      ],
      "scope": "2025–2026 оны хичээлийн жилийн намрын улирал.",
      "notes": "",
      "approval_status": "draft",
      "approved_by": null,
      "approved_at": null,
      "valid_from": null,
      "valid_until": null
    },
    {
      "fact_id": "cs.sakura.activities",
      "entity_id": "nmct.computer_science",
      "key": "sakura_activities",
      "value": [
        "онлайн сургалт",
        "оюутны дадлага",
        "уралдаанд зориулсан үүлэн серверийн дэмжлэг"
      ],
      "source_refs": [
        {
          "document_id": "nmct-cs-web-20261007",
          "version": 1,
          "locator": "Хамтын ажиллагаа / Sakura Internet"
        }
      ],
      "scope": "Хуудасны тайлбарт дурдсан чиглэлүүд; өнөөдрийн идэвхтэй үйлчилгээний амлалт биш.",
      "notes": "",
      "approval_status": "draft",
      "approved_by": null,
      "approved_at": null,
      "valid_from": null,
      "valid_until": null
    },
    {
      "fact_id": "cs.program.url",
      "entity_id": "nmct.computer_science",
      "key": "program_url",
      "value": "https://nmct.edu.mn/programs/computer-science-program",
      "source_refs": [
        {
          "document_id": "nmct-cs-program-web-20261009",
          "version": 1,
          "locator": "Хөтөлбөрийн үндсэн хуудас"
        }
      ],
      "scope": "Хөтөлбөрийн ерөнхий танилцуулга; курс/улирлын нарийвчилсан төлөвлөгөө гэж хэлэхгүй.",
      "notes": "Source update/validity dates and human approval remain unknown.",
      "approval_status": "draft",
      "approved_by": null,
      "approved_at": null,
      "valid_from": null,
      "valid_until": null
    },
    {
      "fact_id": "cs.program.topics",
      "entity_id": "nmct.computer_science",
      "key": "program_topics",
      "value": [
        "программчлал",
        "алгоритм ба өгөгдлийн бүтэц",
        "программ хангамжийн инженерчлэл",
        "өгөгдлийн сан",
        "компьютерийн сүлжээ",
        "хиймэл оюун ухаан"
      ],